Platform,Comment
YouTube,This video was amazing!
YouTube,The editing could be better.
YouTube,I learned so much from this video.
YouTube,Not the best content today.
YouTube,Awesome explanation very clear.
YouTube,This tutorial helped me a lot.
YouTube,I didn't like the background music.
YouTube,Perfect content keep going!
YouTube,This video is too long.
Reddit,The new update is terrible.
Reddit,Great improvement this time.
Reddit,People are overreacting again.
Reddit,I love this community.
Reddit,This feature is actually useful.
Reddit,The developers ruined everything.
Reddit,Finally something good from this subreddit.
Reddit,This opinion is completely wrong.
Reddit,Very informative discussion!
Reddit,Stop spreading misinformation.
Twitter,Loved this product launch!
Twitter,Expected better performance.
Twitter,This is the best thing I saw today.
Twitter,Why is everyone talking about this?
Twitter,The new feature feels useless.
Twitter,This is so inspiring!
Twitter,I absolutely hate the new update.
Twitter,Perfectly explained in one tweet.
Twitter,This made my day.
Twitter,Totally disappointed with this.
Instagram,This post is so aesthetic!
Instagram,Not a fan of this design.
Instagram,Beautiful content as always!
Instagram,I really love your editing style.
Instagram,This reel is so satisfying!
Instagram,This doesn't look good at all.
Instagram,Your creativity is amazing.
Instagram,Too much filter used here.
Instagram,Simple and elegant post.
Instagram,I expected something better.
Facebook,I really love this post!
Facebook,This is not good at all.
Facebook,The update is fine but needs improvements.
Facebook,Very helpful information thank you!
Facebook,This post doesn’t make any sense.
Facebook,Good job keep posting more.
Facebook,I completely disagree with this.
Facebook,This is extremely useful.
Facebook,Please stop sharing fake news.
Facebook,One of the best posts I saw today.
